# Logi Litra Glow
# 0x05, 0x0c,                    // Usage Page (Consumer Devices)       0
# 0x09, 0x01,                    // Usage (Consumer Control)            2
# 0xa1, 0x01,                    // Collection (Application)            4
# 0xa1, 0x03,                    //  Collection (Report)                6
# 0x09, 0x30,                    //   Usage (Power)                     8
# 0x85, 0x01,                    //   Report ID (1)                     10
# 0x15, 0xff,                    //   Logical Minimum (-1)              12
# 0x25, 0x01,                    //   Logical Maximum (1)               14
# 0x95, 0x01,                    //   Report Count (1)                  16
# 0x75, 0x02,                    //   Report Size (2)                   18
# 0x91, 0x26,                    //   Output (Data,Var,Rel,NoPref)      20
# 0x09, 0x1f,                    //   Usage (Vendor Usage 0x1f)         22
# 0x81, 0x00,                    //   Input (Data,Arr,Abs)              24
# 0x95, 0x01,                    //   Report Count (1)                  26
# 0x75, 0x06,                    //   Report Size (6)                   28
# 0x91, 0x03,                    //   Output (Cnst,Var,Abs)             30
# 0x09, 0x1f,                    //   Usage (Vendor Usage 0x1f)         32
# 0x81, 0x03,                    //   Input (Cnst,Var,Abs)              34
# 0xc0,                          //  End Collection                     36
# 0xa1, 0x03,                    //  Collection (Report)                37
# 0x09, 0x30,                    //   Usage (Power)                     39
# 0x85, 0x02,                    //   Report ID (2)                     41
# 0x15, 0x00,                    //   Logical Minimum (0)               43
# 0x25, 0x01,                    //   Logical Maximum (1)               45
# 0x95, 0x01,                    //   Report Count (1)                  47
# 0x75, 0x01,                    //   Report Size (1)                   49
# 0x91, 0x06,                    //   Output (Data,Var,Rel)             51
# 0x95, 0x01,                    //   Report Count (1)                  53
# 0x75, 0x07,                    //   Report Size (7)                   55
# 0x91, 0x03,                    //   Output (Cnst,Var,Abs)             57
# 0xc0,                          //  End Collection                     59
# 0xc0,                          // End Collection                      60
# 0x06, 0x43, 0xff,              // Usage Page (Vendor Usage Page 0xff43) 61
# 0x0a, 0x02, 0x02,              // Usage (Vendor Usage 0x202)          64
# 0xa1, 0x01,                    // Collection (Application)            67
# 0x85, 0x11,                    //  Report ID (17)                     69
# 0x75, 0x08,                    //  Report Size (8)                    71
# 0x95, 0x13,                    //  Report Count (19)                  73
# 0x15, 0x00,                    //  Logical Minimum (0)                75
# 0x26, 0xff, 0x00,              //  Logical Maximum (255)              77
# 0x09, 0x02,                    //  Usage (Vendor Usage 0x02)          80
# 0x81, 0x00,                    //  Input (Data,Arr,Abs)               82
# 0x09, 0x02,                    //  Usage (Vendor Usage 0x02)          84
# 0x91, 0x00,                    //  Output (Data,Arr,Abs)              86
# 0xc0,                          // End Collection                      88
# 
R: 89 05 0c 09 01 a1 01 a1 03 09 30 85 01 15 ff 25 01 95 01 75 02 91 26 09 1f 81 00 95 01 75 06 91 03 09 1f 81 03 c0 a1 03 09 30 85 02 15 00 25 01 95 01 75 01 91 06 95 01 75 07 91 03 c0 c0 06 43 ff 0a 02 02 a1 01 85 11 75 08 95 13 15 00 26 ff 00 09 02 81 00 09 02 91 00 c0
N: Logi Litra Glow
I: 3 046d c900
# ReportID: 17 /Array ['ff', '04', '0xff430002', '01', '0xff430002', '0xff430002', '0xff430002', '0xff430002', '0xff430002', '0xff430002', '0xff430002', '0xff430002', '0xff430002', '0xff430002', '0xff430002', '0xff430002', '0xff430002', '0xff430002', '0xff430002'] 
E: 000000.000000 20 11 ff 04 00 01 00 00 00 00 00 00 00 00 00 00 00 00 00 00 00
# ReportID: 17 /Array ['ff', '04', '10', '0xff430002', '38', '0xff430002', '0xff430002', '0xff430002', '0xff430002', '0xff430002', '0xff430002', '0xff430002', '0xff430002', '0xff430002', '0xff430002', '0xff430002', '0xff430002', '0xff430002', '0xff430002'] 
E: 000019.887956 20 11 ff 04 10 00 38 00 00 00 00 00 00 00 00 00 00 00 00 00 00
# ReportID: 17 /Array ['ff', '04', '10', '0xff430002', '1c', '0xff430002', '0xff430002', '0xff430002', '0xff430002', '0xff430002', '0xff430002', '0xff430002', '0xff430002', '0xff430002', '0xff430002', '0xff430002', '0xff430002', '0xff430002', '0xff430002'] 
E: 000021.423897 20 11 ff 04 10 00 1c 00 00 00 00 00 00 00 00 00 00 00 00 00 00
# ReportID: 17 /Array ['ff', '04', '10', '0xff430002', '38', '0xff430002', '0xff430002', '0xff430002', '0xff430002', '0xff430002', '0xff430002', '0xff430002', '0xff430002', '0xff430002', '0xff430002', '0xff430002', '0xff430002', '0xff430002', '0xff430002'] 
E: 000024.516784 20 11 ff 04 10 00 38 00 00 00 00 00 00 00 00 00 00 00 00 00 00
# ReportID: 17 /Array ['ff', '04', '10', '0xff430002', '54', '0xff430002', '0xff430002', '0xff430002', '0xff430002', '0xff430002', '0xff430002', '0xff430002', '0xff430002', '0xff430002', '0xff430002', '0xff430002', '0xff430002', '0xff430002', '0xff430002'] 
E: 000025.138619 20 11 ff 04 10 00 54 00 00 00 00 00 00 00 00 00 00 00 00 00 00
# ReportID: 17 /Array ['ff', '04', '10', '0xff430002', '94', '0xff430002', '0xff430002', '0xff430002', '0xff430002', '0xff430002', '0xff430002', '0xff430002', '0xff430002', '0xff430002', '0xff430002', '0xff430002', '0xff430002', '0xff430002', '0xff430002'] 
E: 000025.549802 20 11 ff 04 10 00 94 00 00 00 00 00 00 00 00 00 00 00 00 00 00
# ReportID: 17 /Array ['ff', '04', '10', '0xff430002', 'fa', '0xff430002', '0xff430002', '0xff430002', '0xff430002', '0xff430002', '0xff430002', '0xff430002', '0xff430002', '0xff430002', '0xff430002', '0xff430002', '0xff430002', '0xff430002', '0xff430002'] 
E: 000026.027963 20 11 ff 04 10 00 fa 00 00 00 00 00 00 00 00 00 00 00 00 00 00
# ReportID: 17 /Array ['ff', '04', '10', '0xff430002', '94', '0xff430002', '0xff430002', '0xff430002', '0xff430002', '0xff430002', '0xff430002', '0xff430002', '0xff430002', '0xff430002', '0xff430002', '0xff430002', '0xff430002', '0xff430002', '0xff430002'] 
E: 000027.179758 20 11 ff 04 10 00 94 00 00 00 00 00 00 00 00 00 00 00 00 00 00
# ReportID: 17 /Array ['ff', '04', '10', '0xff430002', '54', '0xff430002', '0xff430002', '0xff430002', '0xff430002', '0xff430002', '0xff430002', '0xff430002', '0xff430002', '0xff430002', '0xff430002', '0xff430002', '0xff430002', '0xff430002', '0xff430002'] 
E: 000027.409975 20 11 ff 04 10 00 54 00 00 00 00 00 00 00 00 00 00 00 00 00 00
# ReportID: 17 /Array ['ff', '04', '10', '0xff430002', '38', '0xff430002', '0xff430002', '0xff430002', '0xff430002', '0xff430002', '0xff430002', '0xff430002', '0xff430002', '0xff430002', '0xff430002', '0xff430002', '0xff430002', '0xff430002', '0xff430002'] 
E: 000027.657710 20 11 ff 04 10 00 38 00 00 00 00 00 00 00 00 00 00 00 00 00 00
# ReportID: 17 /Array ['ff', '04', '10', '0xff430002', '1c', '0xff430002', '0xff430002', '0xff430002', '0xff430002', '0xff430002', '0xff430002', '0xff430002', '0xff430002', '0xff430002', '0xff430002', '0xff430002', '0xff430002', '0xff430002', '0xff430002'] 
E: 000027.882680 20 11 ff 04 10 00 1c 00 00 00 00 00 00 00 00 00 00 00 00 00 00
# ReportID: 17 /Array ['ff', '04', '10', '0xff430002', '38', '0xff430002', '0xff430002', '0xff430002', '0xff430002', '0xff430002', '0xff430002', '0xff430002', '0xff430002', '0xff430002', '0xff430002', '0xff430002', '0xff430002', '0xff430002', '0xff430002'] 
E: 000028.755752 20 11 ff 04 10 00 38 00 00 00 00 00 00 00 00 00 00 00 00 00 00
# ReportID: 17 /Array ['ff', '04', '10', '0xff430002', '54', '0xff430002', '0xff430002', '0xff430002', '0xff430002', '0xff430002', '0xff430002', '0xff430002', '0xff430002', '0xff430002', '0xff430002', '0xff430002', '0xff430002', '0xff430002', '0xff430002'] 
E: 000029.017690 20 11 ff 04 10 00 54 00 00 00 00 00 00 00 00 00 00 00 00 00 00
# ReportID: 17 /Array ['ff', '04', '10', '0xff430002', '94', '0xff430002', '0xff430002', '0xff430002', '0xff430002', '0xff430002', '0xff430002', '0xff430002', '0xff430002', '0xff430002', '0xff430002', '0xff430002', '0xff430002', '0xff430002', '0xff430002'] 
E: 000029.237701 20 11 ff 04 10 00 94 00 00 00 00 00 00 00 00 00 00 00 00 00 00
# ReportID: 17 /Array ['ff', '04', '10', '0xff430002', 'fa', '0xff430002', '0xff430002', '0xff430002', '0xff430002', '0xff430002', '0xff430002', '0xff430002', '0xff430002', '0xff430002', '0xff430002', '0xff430002', '0xff430002', '0xff430002', '0xff430002'] 
E: 000029.464694 20 11 ff 04 10 00 fa 00 00 00 00 00 00 00 00 00 00 00 00 00 00
# ReportID: 17 /Array ['ff', '04', '10', '0xff430002', '94', '0xff430002', '0xff430002', '0xff430002', '0xff430002', '0xff430002', '0xff430002', '0xff430002', '0xff430002', '0xff430002', '0xff430002', '0xff430002', '0xff430002', '0xff430002', '0xff430002'] 
E: 000030.616773 20 11 ff 04 10 00 94 00 00 00 00 00 00 00 00 00 00 00 00 00 00
# ReportID: 17 /Array ['ff', '04', '10', '0xff430002', '54', '0xff430002', '0xff430002', '0xff430002', '0xff430002', '0xff430002', '0xff430002', '0xff430002', '0xff430002', '0xff430002', '0xff430002', '0xff430002', '0xff430002', '0xff430002', '0xff430002'] 
E: 000031.025966 20 11 ff 04 10 00 54 00 00 00 00 00 00 00 00 00 00 00 00 00 00
# ReportID: 17 /Array ['ff', '04', '10', '0xff430002', '38', '0xff430002', '0xff430002', '0xff430002', '0xff430002', '0xff430002', '0xff430002', '0xff430002', '0xff430002', '0xff430002', '0xff430002', '0xff430002', '0xff430002', '0xff430002', '0xff430002'] 
E: 000031.245808 20 11 ff 04 10 00 38 00 00 00 00 00 00 00 00 00 00 00 00 00 00
# ReportID: 17 /Array ['ff', '04', '10', '0xff430002', '1c', '0xff430002', '0xff430002', '0xff430002', '0xff430002', '0xff430002', '0xff430002', '0xff430002', '0xff430002', '0xff430002', '0xff430002', '0xff430002', '0xff430002', '0xff430002', '0xff430002'] 
E: 000031.472694 20 11 ff 04 10 00 1c 00 00 00 00 00 00 00 00 00 00 00 00 00 00
# ReportID: 17 /Array ['ff', '04', '10', '0xff430002', '38', '0xff430002', '0xff430002', '0xff430002', '0xff430002', '0xff430002', '0xff430002', '0xff430002', '0xff430002', '0xff430002', '0xff430002', '0xff430002', '0xff430002', '0xff430002', '0xff430002'] 
E: 000032.533976 20 11 ff 04 10 00 38 00 00 00 00 00 00 00 00 00 00 00 00 00 00
# ReportID: 17 /Array ['ff', '04', '10', '0xff430002', '54', '0xff430002', '0xff430002', '0xff430002', '0xff430002', '0xff430002', '0xff430002', '0xff430002', '0xff430002', '0xff430002', '0xff430002', '0xff430002', '0xff430002', '0xff430002', '0xff430002'] 
E: 000032.785983 20 11 ff 04 10 00 54 00 00 00 00 00 00 00 00 00 00 00 00 00 00
# ReportID: 17 /Array ['ff', '04', '10', '0xff430002', '94', '0xff430002', '0xff430002', '0xff430002', '0xff430002', '0xff430002', '0xff430002', '0xff430002', '0xff430002', '0xff430002', '0xff430002', '0xff430002', '0xff430002', '0xff430002', '0xff430002'] 
E: 000033.001782 20 11 ff 04 10 00 94 00 00 00 00 00 00 00 00 00 00 00 00 00 00
# ReportID: 17 /Array ['ff', '04', '10', '0xff430002', 'fa', '0xff430002', '0xff430002', '0xff430002', '0xff430002', '0xff430002', '0xff430002', '0xff430002', '0xff430002', '0xff430002', '0xff430002', '0xff430002', '0xff430002', '0xff430002', '0xff430002'] 
E: 000033.187799 20 11 ff 04 10 00 fa 00 00 00 00 00 00 00 00 00 00 00 00 00 00
# ReportID: 17 /Array ['ff', '04', '10', '0xff430002', '94', '0xff430002', '0xff430002', '0xff430002', '0xff430002', '0xff430002', '0xff430002', '0xff430002', '0xff430002', '0xff430002', '0xff430002', '0xff430002', '0xff430002', '0xff430002', '0xff430002'] 
E: 000034.174967 20 11 ff 04 10 00 94 00 00 00 00 00 00 00 00 00 00 00 00 00 00
# ReportID: 17 /Array ['ff', '04', '10', '0xff430002', '54', '0xff430002', '0xff430002', '0xff430002', '0xff430002', '0xff430002', '0xff430002', '0xff430002', '0xff430002', '0xff430002', '0xff430002', '0xff430002', '0xff430002', '0xff430002', '0xff430002'] 
E: 000034.357969 20 11 ff 04 10 00 54 00 00 00 00 00 00 00 00 00 00 00 00 00 00
# ReportID: 17 /Array ['ff', '04', '10', '0xff430002', '38', '0xff430002', '0xff430002', '0xff430002', '0xff430002', '0xff430002', '0xff430002', '0xff430002', '0xff430002', '0xff430002', '0xff430002', '0xff430002', '0xff430002', '0xff430002', '0xff430002'] 
E: 000034.538724 20 11 ff 04 10 00 38 00 00 00 00 00 00 00 00 00 00 00 00 00 00
# ReportID: 17 /Array ['ff', '04', '10', '0xff430002', '1c', '0xff430002', '0xff430002', '0xff430002', '0xff430002', '0xff430002', '0xff430002', '0xff430002', '0xff430002', '0xff430002', '0xff430002', '0xff430002', '0xff430002', '0xff430002', '0xff430002'] 
E: 000034.795984 20 11 ff 04 10 00 1c 00 00 00 00 00 00 00 00 00 00 00 00 00 00
# ReportID: 17 /Array ['ff', '04', '0xff430002', '0xff430002', '0xff430002', '0xff430002', '0xff430002', '0xff430002', '0xff430002', '0xff430002', '0xff430002', '0xff430002', '0xff430002', '0xff430002', '0xff430002', '0xff430002', '0xff430002', '0xff430002', '0xff430002'] 
E: 000036.453825 20 11 ff 04 00 00 00 00 00 00 00 00 00 00 00 00 00 00 00 00 00
