ffff931d4f721300 291291780 C Ii:1:001:1 0:128 2 = 0400
ffff931d4f721300 291291819 S Ii:1:001:1 -115:128 2 <
ffff931c64df8780 291291886 S Ci:1:001:0 s a3 00 0000 0002 0004 4 <
ffff931c64df8780 291291985 C Ci:1:001:0 0 4 = 01010100
ffff931c64df8780 291292011 S Co:1:001:0 s 23 01 0010 0002 0000 0
ffff931c64df8780 291292423 C Co:1:001:0 0 0
ffff931c64df8780 291292442 S Ci:1:001:0 s a3 00 0000 0002 0004 4 <
ffff931c64df8780 291292468 C Ci:1:001:0 0 4 = 01010000
ffff931c64df80c0 291321324 S Ci:1:001:0 s a3 00 0000 0002 0004 4 <
ffff931c64df80c0 291321380 C Ci:1:001:0 0 4 = 01010000
ffff931c64df8840 291349151 S Ci:1:001:0 s a3 00 0000 0002 0004 4 <
ffff931c64df8840 291349216 C Ci:1:001:0 0 4 = 01010000
ffff931c64df8840 291376373 S Ci:1:001:0 s a3 00 0000 0002 0004 4 <
ffff931c64df8840 291376440 C Ci:1:001:0 0 4 = 01010000
ffff931c64df86c0 291403441 S Ci:1:001:0 s a3 00 0000 0002 0004 4 <
ffff931c64df86c0 291403483 C Ci:1:001:0 0 4 = 01010000
ffff931c64df86c0 291403511 S Co:1:001:0 s 23 03 0004 0002 0000 0
ffff931c64df86c0 291439961 C Co:1:001:0 0 0
ffff931c64df86c0 291501255 S Ci:1:001:0 s a3 00 0000 0002 0004 4 <
ffff931c64df86c0 291501361 C Ci:1:001:0 0 4 = 11010000
ffff931c64df86c0 291566818 S Ci:1:001:0 s a3 00 0000 0002 0004 4 <
ffff931c64df86c0 291566922 C Ci:1:001:0 0 4 = 11010000
ffff931d4f721300 291593331 C Ii:1:001:1 0:128 2 = 0400
ffff931d4f721300 291593362 S Ii:1:001:1 -115:128 2 <
ffff931c64df86c0 291771367 S Ci:1:001:0 s a3 00 0000 0002 0004 4 <
ffff931c64df86c0 291771415 C Ci:1:001:0 0 4 = 03011000
ffff931c64df86c0 291771425 S Co:1:001:0 s 23 01 0014 0002 0000 0
ffff931c64df86c0 291771456 C Co:1:001:0 0 0
ffff931c64df86c0 291824228 S Ci:1:000:0 s 80 06 0100 0000 0040 64 <
ffff931c64df86c0 291843614 C Ci:1:000:0 0 18 = 12011001 00000040 6d0400c9 00010102 0301
ffff931c64df86c0 291843691 S Co:1:001:0 s 23 03 0004 0002 0000 0
ffff931c64df86c0 291870330 C Co:1:001:0 0 0
ffff931c64df86c0 291933228 S Ci:1:001:0 s a3 00 0000 0002 0004 4 <
ffff931c64df86c0 291933287 C Ci:1:001:0 0 4 = 13010000
ffff931c64df86c0 291995247 S Ci:1:001:0 s a3 00 0000 0002 0004 4 <
ffff931c64df86c0 291995344 C Ci:1:001:0 0 4 = 13010000
ffff931d4f721300 292036491 C Ii:1:001:1 0:128 2 = 0400
ffff931d4f721300 292036528 S Ii:1:001:1 -115:128 2 <
ffff931c64df86c0 292202211 S Ci:1:001:0 s a3 00 0000 0002 0004 4 <
ffff931c64df86c0 292202262 C Ci:1:001:0 0 4 = 03011000
ffff931c64df86c0 292202284 S Co:1:001:0 s 23 01 0014 0002 0000 0
ffff931c64df86c0 292202317 C Co:1:001:0 0 0
ffff931c64df86c0 292254257 S Co:1:000:0 s 00 05 0003 0000 0000 0
ffff931c64df86c0 292258990 C Co:1:000:0 0 0
ffff931c64df86c0 292272191 S Ci:1:003:0 s 80 06 0100 0000 0012 18 <
ffff931c64df86c0 292275104 C Ci:1:003:0 0 18 = 12011001 00000040 6d0400c9 00010102 0301
ffff931c64df86c0 292275500 S Ci:1:003:0 s 80 06 0200 0000 0009 9 <
ffff931c64df86c0 292279429 C Ci:1:003:0 0 9 = 09022900 01010080 fa
ffff931c64df86c0 292279516 S Ci:1:003:0 s 80 06 0200 0000 0029 41 <
ffff931c64df86c0 292283728 C Ci:1:003:0 0 41 = 09022900 01010080 fa090400 00020300 00000921 11010001 22590007 05820340
ffff931c64df8c00 292283875 S Ci:1:003:0 s 80 06 0300 0000 00ff 255 <
ffff931c64df8c00 292288063 C Ci:1:003:0 0 4 = 04030904
ffff931c64df8c00 292288237 S Ci:1:003:0 s 80 06 0302 0409 00ff 255 <
ffff931c64df8c00 292292416 C Ci:1:003:0 0 22 = 16034c00 69007400 72006100 20004700 6c006f00 7700
ffff931c64df8c00 292292514 S Ci:1:003:0 s 80 06 0301 0409 00ff 255 <
ffff931c64df8c00 292296740 C Ci:1:003:0 0 10 = 0a034c00 6f006700 6900
ffff931c64df8c00 292296809 S Ci:1:003:0 s 80 06 0303 0409 00ff 255 <
ffff931c64df8c00 292301252 C Ci:1:003:0 0 26 = 1a033200 32003200 32004600 45003100 30003000 42004c00 3800
ffff931c64df8c00 292302273 S Co:1:003:0 s 00 09 0001 0000 0000 0
ffff931c64df8c00 292304338 C Co:1:003:0 0 0
ffff931c64df8c00 292306382 S Ci:1:003:0 s 80 06 0303 0409 00ff 255 <
ffff931c64df8c00 297531813 C Ci:1:003:0 -2 0
ffff931c64df8c00 297532070 S Ci:1:003:0 s 80 06 0303 0409 0002 2 <
ffff931c64df8c00 297553925 C Ci:1:003:0 0 2 = 1a03
ffff931c64df8c00 297554035 S Ci:1:003:0 s 80 06 0303 0409 001a 26 <
ffff931c64df8c00 297558280 C Ci:1:003:0 0 26 = 1a033200 32003200 32004600 45003100 30003000 42004c00 3800
ffff931c64df8c00 297558710 S Co:1:003:0 s 21 0a 0000 0000 0000 0
ffff931c64df8c00 297562648 C Co:1:003:0 0 0
ffff931c64df8c00 297562761 S Ci:1:003:0 s 81 06 2200 0000 0059 89 <
ffff931c64df8c00 297567226 C Ci:1:003:0 0 89 = 050c0901 a101a103 09308501 15ff2501 95017502 9126091f 81009501 75069103
ffff931c64df8c00 297567870 S Ci:1:001:0 s a3 00 0000 0002 0004 4 <
ffff931c64df8c00 297568095 C Ci:1:001:0 0 4 = 03010000
ffff931cb1656780 297612917 S Ii:1:003:2 -115:1 20 <
ffff931cb1656900 297669023 S Io:1:003:2 -115:1 20 = 11ff0011 00005a00 00000000 00000000 00000000
ffff931cb1656900 297675624 C Io:1:003:2 0:1 20 >
ffff931cb1656780 297677787 C Ii:1:003:2 0:1 20 = 11ff0011 04025a00 00000000 00000000 00000000
ffff931cb1656780 297677848 S Ii:1:003:2 -115:1 20 <
ffff931cb1656900 297677919 S Io:1:003:2 -115:1 20 = 11ff0001 00050000 00000000 00000000 00000000
ffff931cb1656900 297680946 C Io:1:003:2 0:1 20 >
ffff931cb1656780 297770148 C Ii:1:003:2 0:1 20 = 11ff0001 03000000 00000000 00000000 00000000
ffff931cb1656780 297770246 S Ii:1:003:2 -115:1 20 <
ffff931c9afe8780 297770738 S Io:1:003:2 -115:1 20 = 11ff0301 00000000 00000000 00000000 00000000
ffff931c9afe8780 297778959 C Io:1:003:2 0:1 20 >
ffff931cb1656780 297862196 C Ii:1:003:2 0:1 20 = 11ff0301 0a000000 00000000 00000000 00000000
ffff931cb1656780 297862277 S Ii:1:003:2 -115:1 20 <
ffff931c9afe8c00 297862341 S Io:1:003:2 -115:1 20 = 11ff0311 00000000 00000000 00000000 00000000
ffff931c9afe8c00 297865009 C Io:1:003:2 0:1 20 >
ffff931cb1656780 297954074 C Ii:1:003:2 0:1 20 = 11ff0311 4c697472 6120476c 6f770000 00000000
ffff931cb1656780 297954138 S Ii:1:003:2 -115:1 20 <
ffff931c9afe8c00 297954609 S Io:1:003:2 -115:1 20 = 11ff0001 1d4b0000 00000000 00000000 00000000
ffff931c9afe8c00 297961048 C Io:1:003:2 0:1 20 >
ffff931cb1656780 298046197 C Ii:1:003:2 0:1 20 = 11ff0001 00000000 00000000 00000000 00000000
ffff931cb1656780 298046254 S Ii:1:003:2 -115:1 20 <
ffff931c9afe8c00 298046293 S Io:1:003:2 -115:1 20 = 11ff0001 00050000 00000000 00000000 00000000
ffff931c9afe8c00 298055140 C Io:1:003:2 0:1 20 >
ffff931cb1656780 298138193 C Ii:1:003:2 0:1 20 = 11ff0001 03000000 00000000 00000000 00000000
ffff931cb1656780 298138285 S Ii:1:003:2 -115:1 20 <
ffff931c9afe8c00 298138318 S Io:1:003:2 -115:1 20 = 11ff0301 00000000 00000000 00000000 00000000
ffff931c9afe8c00 298142100 C Io:1:003:2 0:1 20 >
ffff931cb1656780 298230374 C Ii:1:003:2 0:1 20 = 11ff0301 0a000000 00000000 00000000 00000000
ffff931cb1656780 298230440 S Ii:1:003:2 -115:1 20 <
ffff931c9afe8780 298230621 S Io:1:003:2 -115:1 20 = 11ff0311 00000000 00000000 00000000 00000000
ffff931c9afe8780 298236789 C Io:1:003:2 0:1 20 >
ffff931cb1656780 298322178 C Ii:1:003:2 0:1 20 = 11ff0311 4c697472 6120476c 6f770000 00000000
ffff931cb1656780 298322296 S Ii:1:003:2 -115:1 20 <
ffff931c9afe8780 298322427 S Io:1:003:2 -115:1 20 = 11ff0001 10000000 00000000 00000000 00000000
ffff931c9afe8780 298326831 C Io:1:003:2 0:1 20 >
ffff931cb1656780 298414181 C Ii:1:003:2 0:1 20 = 11ff0001 00000000 00000000 00000000 00000000
ffff931cb1656780 298414290 S Ii:1:003:2 -115:1 20 <
ffff931c9afe8c00 298414362 S Io:1:003:2 -115:1 20 = 11ff0001 10040000 00000000 00000000 00000000
ffff931c9afe8c00 298422102 C Io:1:003:2 0:1 20 >
ffff931cb1656780 298506273 C Ii:1:003:2 0:1 20 = 11ff0001 00000000 00000000 00000000 00000000
ffff931cb1656780 298506335 S Ii:1:003:2 -115:1 20 <
ffff931c9afe8c00 298506422 S Io:1:003:2 -115:1 20 = 11ff0001 10010000 00000000 00000000 00000000
ffff931c9afe8c00 298508134 C Io:1:003:2 0:1 20 >
ffff931cb1656780 298598136 C Ii:1:003:2 0:1 20 = 11ff0001 00000000 00000000 00000000 00000000
ffff931cb1656780 298598194 S Ii:1:003:2 -115:1 20 <
ffff931c9afe8c00 298598314 S Io:1:003:2 -115:1 20 = 11ff0001 21210000 00000000 00000000 00000000
ffff931c9afe8c00 298606002 C Io:1:003:2 0:1 20 >
ffff931cb1656780 298699205 C Ii:1:003:2 0:1 20 = 11ff0001 00000000 00000000 00000000 00000000
ffff931cb1656780 298699298 S Ii:1:003:2 -115:1 20 <
ffff931c9afe8c00 298699423 S Io:1:003:2 -115:1 20 = 11ff0001 21200000 00000000 00000000 00000000
ffff931c9afe8c00 298720209 C Io:1:003:2 0:1 20 >
ffff931cb1656780 298783209 C Ii:1:003:2 0:1 20 = 11ff0001 00000000 00000000 00000000 00000000
ffff931cb1656780 298783262 S Ii:1:003:2 -115:1 20 <
ffff931c9afe8c00 298783373 S Io:1:003:2 -115:1 20 = 11ff0001 19900000 00000000 00000000 00000000
ffff931c9afe8c00 298789950 C Io:1:003:2 0:1 20 >
ffff931cb1656780 298875175 C Ii:1:003:2 0:1 20 = 11ff0001 04000000 00000000 00000000 00000000
ffff931cb1656780 298875297 S Ii:1:003:2 -115:1 20 <
ffff931c9afe8c00 298875579 S Io:1:003:2 -115:1 20 = 11ff0421 00000000 00000000 00000000 00000000
ffff931c9afe8c00 298878013 C Io:1:003:2 0:1 20 >
ffff931cb1656780 298967239 C Ii:1:003:2 0:1 20 = 11ff0421 05001400 fa000107 00000000 00000000
ffff931cb1656780 298967293 S Ii:1:003:2 -115:1 20 <
ffff931c9afe8c00 298967420 S Io:1:003:2 -115:1 20 = 11ff0471 00000000 00000000 00000000 00000000
ffff931c9afe8c00 298973405 C Io:1:003:2 0:1 20 >
ffff931cb1656780 299059063 C Ii:1:003:2 0:1 20 = 11ff0471 050a8c19 64006407 00000000 00000000
ffff931cb1656780 299059108 S Ii:1:003:2 -115:1 20 <
ffff931c9afe8c00 299059317 S Io:1:003:2 -115:1 20 = 11ff0401 00000000 00000000 00000000 00000000
ffff931c9afe8c00 299067726 C Io:1:003:2 0:1 20 >
ffff931cb1656780 299151233 C Ii:1:003:2 0:1 20 = 11ff0401 00000000 00000000 00000000 00000000
ffff931cb1656780 299151279 S Ii:1:003:2 -115:1 20 <
ffff931cb1656780 299153728 C Ii:1:003:2 -2:1 0
ffff931c9afe8c00 299184345 S Ii:1:003:2 -115:1 20 <
ffff931c9afe8c00 299248235 C Ii:1:003:2 -2:1 0
ffff931c9afe8c00 299288603 S Ii:1:003:2 -115:1 20 <
ffff931c9afe8c00 299373348 C Ii:1:003:2 -2:1 0

ffff931cb1656d80 370238698 S Io:1:003:2 -115:1 20 = 11ff0401 00000000 00000000 00000000 00000000
ffff931cb1656d80 370250631 C Io:1:003:2 0:1 20 >
